"absolutes Rauchverbot, auch im Eingangsbereich und nahe am Haus, Wir bitten unsere Gäste, Energie zu sparen und nicht unnötig Lichter brennen zu lassen, bei geschlossenen Vorhängen oder AirConditioner wenn niemand zu Hause ist",1 bath,2 beds,2 bedrooms,4 guests,165952,"Two Bedroom, One Bathroom Apartment",4,11,Conrad,['Deutsch'],Entire apartment,entire_home,0,,3,False,False,2PM - 12AM (midnight),12PM (noon),41.94274,-87.67321,850.0,R17000015786,True,,157,60,91.0,60,,,False,[],False,False,True,,4.53,This host offers 10% off if you stay a week and a 33% monthly discount.,"[{'id': 4, 'is_business_ready_feature': False, 'is_present': True, 'is_safety_feature': False, 'name': 'Wifi'}, {'id': 8, 'is_business_ready_feature': False, 'is_present': True, 'is_safety_feature': False, 'name': 'Kitchen'}, {'id': 47, 'is_business_ready_feature': True, 'is_present': True, 'is_safety_feature': False, 'name': 'Laptop friendly workspace'}, {'id': 44, 'is_business_ready_feature': True, 'is_present': True, 'is_safety_feature': False, 'name': 'Hangers'}, {'id': 1, 'is_business_ready_feature': False, 'is_present': True, 'is_safety_feature': False, 'name': 'TV'}, {'id': 46, 'is_business_ready_feature': True, 'is_present': True, 'is_safety_feature': False, 'name': 'Iron'}, {'id': 33, 'is_business_ready_feature': False, 'is_present': False, 'is_safety_feature': False, 'name': 'Washer'}, {'id': 45, 'is_business_ready_feature': True, 'is_present': True, 'is_safety_feature': False, 'name': 'Hair dryer'}, {'id': 41, 'is_business_ready_feature': False, 'is_present': True, 'is_safety_feature': False, 'name': 'Shampoo'}, {'id': 30, 'is_business_ready_feature': False, 'is_present': True, 'is_safety_feature': False, 'name': 'Heating'}, {'id': 40, 'is_business_ready_feature': False, 'is_present': True, 'is_safety_feature': False, 'name': 'Essentials'}, {'id': 5, 'is_business_ready_feature': False, 'is_present': True, 'is_safety_feature': False, 'name': 'Air conditioning'}, {'id': 77, 'is_business_ready_feature': False, 'is_present': True, 'is_safety_feature': False, 'name': 'Hot water'}, {'id': 23, 'is_business_ready_feature': False, 'is_present': True, 'is_safety_feature': False, 'name': 'Free street parking'}, {'id': 93, 'is_business_ready_feature': False, 'is_present': True, 'is_safety_feature': False, 'name': 'Dishes and silverware'}, {'id': 129, 'is_business_ready_feature': False, 'is_present': True, 'is_safety_feature': False, 'name': 'Host greets you'}, {'id': 57, 'is_business_ready_feature': False, 'is_present': False, 'is_safety_feature': False, 'name': 'Private entrance'}, {'id': 103, 'is_business_ready_feature': False, 'is_present': True, 'is_safety_feature': False, 'name': 'Luggage dropoff allowed'}, {'id': 104, 'is_business_ready_feature': False, 'is_present': True, 'is_safety_feature': False, 'name': 'Long term stays allowed'}, {'id': 36, 'is_business_ready_feature': False, 'is_present': True, 'is_safety_feature': True, 'name': 'Carbon monoxide detector'}, {'id': 35, 'is_business_ready_feature': False, 'is_present': True, 'is_safety_feature': True, 'name': 'Smoke detector'}]","[{'type': 'LISTING_COMMUNICATION_REVIEW_RATING', 'message': '100% of recent guests rated Conrad 5-star in communication.', 'headline': 'Great communication'}, {'type': 'LISTING_OUTSTANDING_HOSPITALITY', 'message': '7 recent guests complimented Conrad for outstanding hospitality.', 'headline': 'Outstanding hospitality'}]","[{'type': 'requires_stairs', 'title': 'Must climb stairs'}, {'type': 'security_deposit', 'title': 'Security Deposit - if you damage the home, you may be charged up to $200'}]",,"[{'category': 'accuracy', 'value': 9, 'localized_rating': '4.6', 'percentage': 0.9279999999999999}, {'category': 'communication', 'value': 9, 'localized_rating': '4.7', 'percentage': 0.942}, {'category': 'cleanliness', 'value': 9, 'localized_rating': '4.6', 'percentage': 0.916}, {'category': 'location', 'value': 9, 'localized_rating': '4.8', 'percentage': 0.95}, {'category': 'checkin', 'value': 9, 'localized_rating': '4.7', 'percentage': 0.9480000000000001}, {'category': 'value', 'value': 9, 'localized_rating': '4.3', 'percentage': 0.86}]",,"{1: [{'quantity': 1, 'type': 'queen_bed'}], 2: [{'quantity': 1, 'type': 'queen_bed'}]}",791089,True,False,July 2011,100%,within an hour,False,https://a0.muscache.com/im/users/791089/profile_pic/1353767818/original.jpg?aki_policy=profile_large,,"Spacious, elegantly appointed and furnished Lakeview vacation/executive 2 BR 1 Bath
First floor on a quiet, tree lined street, The entire apartment either features oak floors or ceramic tiles,
all solid oak doors and windows, oriental rugs, even a piano. Hotel grade mattresses on queen sized beds with Egyptian Cotton linens.
a 40 in flat panel television, original art work
fully equipped big kitchen with dinette set, additional breakfast room overlooking the garden, coffee maker, espresso maker, microwave
3 mins to Brown Line, no permit required for parking.

We hope you find everything to your liking. Here are some suggestions and requests that should make your stay as comfortable as possible: You will notice that the location is the best between being close to the city and being in a quiet residential neighborhood. The CTA Brownline Paulina Station is just minutes away, the No. 11 Bus even closer. Whole Foods Market is the preferred upscale source for nourishments and the best fruits and vegetables for the discriminating taste. Jewel Foods is about 4 blocks south between Paulina and Ashland. There are several bars and restaurants in walking distance, feel free to inquire about recommendations.
You will find our beds comfortable, with hotel grade mattresses and 100% cotton linens, there are additional blankets and covers available for the asking.

Also, our company manufactures 3in1Dead Sea skin care products, you will find some free samples for your use or take them with you. If you are interested in purchasing some, let us know.",,,,,"Spacious, elegantly appointed and furnished Lakeview vacation/executive 2 BR 1 Bath
First floor on a quiet, tree lined street, The entire apartment either features oak floors or ceramic tiles,
all solid oak doors and windows, oriental rugs, even a piano. Hotel grade mattresses on queen sized beds with Egyptian Cotton linens.
a 40 in flat panel television, original art work
fully equipped big kitchen with dinette set, additional breakfast room overlooking the garden, coffee maker, espresso maker, microwave
3 mins to Brown Line, no permit required for parking.

We hope you find everything to your liking. Here are some suggestions and requests that should make your stay as comfortable as possible: You will notice that the location is the best between being close to the city and being in a quiet residential neighborhood. The CTA Brownline Paulina Station is just minutes away, the No. 11 Bus even closer. Whole Foods Market is the preferred upscale source for nourishments and the best fruits and vegetables for the discriminating taste. Jewel Foods is about 4 blocks south between Paulina and Ashland. There are several bars and restaurants in walking distance, feel free to inquire about recommendations.
You will find our beds comfortable, with hotel grade mattresses and 100% cotton linens, there are additional blankets and covers available for the asking.

Also, our company manufactures 3in1Dead Sea skin care products, you will find some free samples for your use or take them with you. If you are interested in purchasing some, let us know.",,,False,False,False,False,,True,False,35.0,"[{'milestones': {'titles': ['<b>Jan 11, 2:00PM</b>', 'Check-in'], 'subtitles': [], 'type': 'check_in'}, 'localized_cancellation_policy_name': 'Strict', 'cancellation_policy_label': 'strict_14_with_grace_period', 'cancellation_policy_price_type': None, 'cancellation_policy_price_factor': 0.0, 'cancellation_policy_id': 44, 'book_it_module_tooltip': 'After that, cancel before 2:00PM on Jan 4 and get a 50% refund, minus the service fee.', 'subtitle': 'After that, cancel before 2:00PM on Jan 4 and get a 50% refund, minus the service fee.'}]",0.0,0.0,0,2020-01-11,2020-01-14,2019-12-28,2019-10-21 21:27:40+00:00,2011-08-05 16:37:09+00:00
,1 bath,3 beds,1 bedroom,6 guests,34802483,Walk to Hollywood Beach from a Mellow Apartment,6,32,Doug,"['English', 'Italiano', 'Português']",Entire apartment,entire_home,0,,2,False,False,After 3PM,12PM (noon),41.99096,-87.65637,845.0,City registration pending,True,False,50,16,91.0,16,,,False,[],False,False,True,,4.56,This host offers 10% off if you stay a week and a 32% monthly discount.,"[{'id': 21, 'is_business_ready_feature': False, 'is_present': True, 'is_safety_feature': False, 'name': 'Elevator'}, {'id': 4, 'is_business_ready_feature': False, 'is_present': True, 'is_safety_feature': False, 'name': 'Wifi'}, {'id': 8, 'is_business_ready_feature': False, 'is_present': True, 'is_safety_feature': False, 'name': 'Kitchen'}, {'id': 2, 'is_business_ready_feature': False, 'is_present': True, 'is_safety_feature': False, 'name': 'Cable TV'}, {'id': 47, 'is_business_ready_feature': True, 'is_present': True, 'is_safety_feature': False, 'name': 'Laptop friendly workspace'}, {'id': 44, 'is_business_ready_feature': True, 'is_present': True, 'is_safety_feature': False, 'name': 'Hangers'}, {'id': 1, 'is_business_ready_feature': False, 'is_present': True, 'is_safety_feature': False, 'name': 'TV'}, {'id': 46, 'is_business_ready_feature': True, 'is_present': True, 'is_safety_feature': False, 'name': 'Iron'}, {'id': 33, 'is_business_ready_feature': False, 'is_present': False, 'is_safety_feature': False, 'name': 'Washer'}, {'id': 45, 'is_business_ready_feature': True, 'is_present': True, 'is_safety_feature': False, 'name': 'Hair dryer'}, {'id': 41, 'is_business_ready_feature': False, 'is_present': True, 'is_safety_feature': False, 'name': 'Shampoo'}, {'id': 30, 'is_business_ready_feature': False, 'is_present': True, 'is_safety_feature': False, 'name': 'Heating'}, {'id': 40, 'is_business_ready_feature': False, 'is_present': True, 'is_safety_feature': False, 'name': 'Essentials'}, {'id': 5, 'is_business_ready_feature': False, 'is_present': True, 'is_safety_feature': False, 'name': 'Air conditioning'}, {'id': 102, 'is_business_ready_feature': False, 'is_present': True, 'is_safety_feature': False, 'name': 'Beach essentials'}, {'id': 77, 'is_business_ready_feature': False, 'is_present': True, 'is_safety_feature': False, 'name': 'Hot water'}, {'id': 23, 'is_business_ready_feature': False, 'is_present': True, 'is_safety_feature': False, 'name': 'Free street parking'}, {'id': 90, 'is_business_ready_feature': False, 'is_present': True, 'is_safety_feature': False, 'name': 'Coffee maker'}, {'id': 94, 'is_business_ready_feature': False, 'is_present': True, 'is_safety_feature': False, 'name': 'Cooking basics'}, {'id': 93, 'is_business_ready_feature': False, 'is_present': True, 'is_safety_feature': False, 'name': 'Dishes and silverware'}, {'id': 91, 'is_business_ready_feature': False, 'is_present': True, 'is_safety_feature': False, 'name': 'Refrigerator'}, {'id': 95, 'is_business_ready_feature': False, 'is_present': True, 'is_safety_feature': False, 'name': 'Oven'}, {'id': 96, 'is_business_ready_feature': False, 'is_present': True, 'is_safety_feature': False, 'name': 'Stove'}, {'id': 54, 'is_business_ready_feature': False, 'is_present': True, 'is_safety_feature': False, 'name': 'Lockbox'}, {'id': 57, 'is_business_ready_feature': False, 'is_present': True, 'is_safety_feature': False, 'name': 'Private entrance'}, {'id': 104, 'is_business_ready_feature': False, 'is_present': True, 'is_safety_feature': False, 'name': 'Long term stays allowed'}, {'id': 85, 'is_business_ready_feature': False, 'is_present': True, 'is_safety_feature': False, 'name': 'Bed linens'}, {'id': 86, 'is_business_ready_feature': False, 'is_present': True, 'is_safety_feature': False, 'name': 'Extra pillows and blankets'}, {'id': 133, 'is_business_ready_feature': False, 'is_present': True, 'is_safety_feature': False, 'name': 'Lake access'}, {'id': 39, 'is_business_ready_feature': False, 'is_present': True, 'is_safety_feature': True, 'name': 'Fire extinguisher'}, {'id': 36, 'is_business_ready_feature': False, 'is_present': True, 'is_safety_feature': True, 'name': 'Carbon monoxide detector'}, {'id': 35, 'is_business_ready_feature': False, 'is_present': True, 'is_safety_feature': True, 'name': 'Smoke detector'}, {'id': 37, 'is_business_ready_feature': False, 'is_present': True, 'is_safety_feature': True, 'name': 'First aid kit'}]","[{'type': 'LISTING_OUTSTANDING_HOSPITALITY', 'message': '8 recent guests complimented David for outstanding hospitality.', 'headline': 'Outstanding hospitality'}, {'type': 'LISTING_SPARKLING_CLEAN', 'message': '8 recent guests said this place was sparkling clean.', 'headline': 'Sparkling clean'}, {'type': 'LISTING_SELF_CHECKIN', 'message': 'Check yourself in with the lockbox.', 'headline': 'Self check-in'}]","[{'type': 'limited_parking', 'title': 'No parking on property'}, {'type': 'security_deposit', 'title': 'Security Deposit - if you damage the home, you may be charged up to $150'}]","[{'id': 129482255, 'member_since': 'May 2017', 'host_name': 'David', 'profile_pic_path': 'https://a0.muscache.com/im/pictures/user/d8bbe38b-6c15-4896-ad0e-fdf2c8916aec.jpg?aki_policy=profile_x_medium'}]","[{'category': 'accuracy', 'value': 10, 'localized_rating': '4.8', 'percentage': 0.95}, {'category': 'communication', 'value': 9, 'localized_rating': '4.7', 'percentage': 0.9380000000000001}, {'category': 'cleanliness', 'value': 9, 'localized_rating': '4.5', 'percentage': 0.9}, {'category': 'location', 'value': 9, 'localized_rating': '4.6', 'percentage': 0.9259999999999999}, {'category': 'checkin', 'value': 9, 'localized_rating': '4.6', 'percentage': 0.9259999999999999}, {'category': 'value', 'value': 9, 'localized_rating': '4.3', 'percentage': 0.8619999999999999}]","[{'localized_text': 'Quick responses', 'localized_count_string': '12'}, {'localized_text': 'Stylish space', 'localized_count_string': '9'}, {'localized_text': 'Sparkling clean', 'localized_count_string': '8'}, {'localized_text': 'Outstanding hospitality', 'localized_count_string': '4'}]","{0: [{'quantity': 2, 'type': 'single_bed'}, {'quantity': 1, 'type': 'couch'}], 1: [{'quantity': 1, 'type': 'air_mattress'}, {'quantity': 1, 'type': 'queen_bed'}]}",71488,True,False,January 2010,100%,within an hour,False,https://a0.muscache.com/im/pictures/user/5bbb84fb-91cc-418f-b3ab-16598c8af501.jpg?aki_policy=profile_large,Entire space,"Walk to Hollywood Beach, dance the night away at tight-knit Andersonville, or stroll along Lake Michigan. This ideally located Scandi-style apartment (inspired by Södermalm, is an island in central Stockholm, Sweden) features a bar, board games and lots of space to spread out and relax.

Towels and toiletries will be included according to number of guests BOOKED. Fees will apply to extra guests. We charge $49 per extra guest per night

This is a private air-conditioned apartment with Scandinavian style, monochrome palette, tucked in between Thorndale Beach and the Redline ‘L’ Station. A walkable wonder and just 14-minutes drive to Grant Park and Magnificent Mile

Entire space

We like in-person check-in but self-check-in and full privacy are offered

A century ago, Chicago had a robust Swedish population whose epicenter was Andersonville. the Swedish influence remains, dotting the stroll-friendly commercial areas with Swedish businesses and restaurants. Lakefront community Edgewater is a liberal, pretty paradise and features Chicago's gay beach at Hollywood.

Chicago's largest park, Lincoln Park, stretches south from Edgewater for seven miles along the waterfront, almost to downtown.

Street parking is free all around but we do offer a garage spot for extra fee (enquire). Redline ‘L’ is a block away

Guests will receive a link with instructions within 24 hours of check-in

FULL DISCLOSURE: If you haven’t used or don’t know how to use a lockbox, self-check-in is not for you. Your check-in should be in-person and between 3PM and 9:30PM. Absolutely no exceptions",,We like in-person check-in but self-check-in and full privacy are offered,"A century ago, Chicago had a robust Swedish population whose epicenter was Andersonville. the Swedish influence remains, dotting the stroll-friendly commercial areas with Swedish businesses and restaurants. Lakefront community Edgewater is a liberal, pretty paradise and features Chicago's gay beach at Hollywood.

Chicago's largest park, Lincoln Park, stretches south from Edgewater for seven miles along the waterfront, almost to downtown.","Guests will receive a link with instructions within 24 hours of check-in

FULL DISCLOSURE: If you haven’t used or don’t know how to use a lockbox, self-check-in is not for you. Your check-in should be in-person and between 3PM and 9:30PM. Absolutely no exceptions","This is a private air-conditioned apartment with Scandinavian style, monochrome palette, tucked in between Thorndale Beach and the Redline ‘L’ Station. A walkable wonder and just 14-minutes drive to Grant Park and Magnificent Mile","Walk to Hollywood Beach, dance the night away at tight-knit Andersonville, or stroll along Lake Michigan. This ideally located Scandi-style apartment (inspired by Södermalm, is an island in central Stockholm, Sweden) features a bar, board games and lots of space to spread out and relax.

Towels and toiletries will be included according to number of guests BOOKED. Fees will apply to extra guests. We charge $49 per extra guest per night",Street parking is free all around but we do offer a garage spot for extra fee (enquire). Redline ‘L’ is a block away,True,True,False,False,,True,False,49.0,"[{'milestones': {'titles': ['<b>Jan 11, 3:00PM</b>', 'Check-in'], 'subtitles': [], 'type': 'check_in'}, 'localized_cancellation_policy_name': 'Moderate', 'cancellation_policy_label': 'moderate', 'cancellation_policy_price_type': None, 'cancellation_policy_price_factor': 0.0, 'cancellation_policy_id': 4, 'book_it_module_tooltip': 'Free cancellation for 48 hours', 'subtitle': 'After that, cancel before 3:00PM on Jan 6 and get a full refund, minus the service fee.'}]",0.0,49.0,1,2020-01-11,2020-01-13,2019-12-28,2019-10-27 19:46:25+00:00,2019-05-19 20:48:38+00:00
"Please let me know if you decide to have additional guest over if they are not listed in your initial booking. 

The part accessible to guest is the basement so it would be expected that the guest would not trespass onto the first and second floor. Also please close lights that are not in use. Thank you!",1 bath,4 beds,1 bedroom,8 guests,18255236,Spacious whole floor,8,12,Belinda,[],Entire guest suite,entire_home,0,,2,False,False,After 1PM,12PM (noon),41.81858,-87.63941,941.0,R17000014342,True,False,3,68,93.0,68,,,False,[],False,False,True,,4.65,This host offers 15% off if you stay a week and a 20% monthly discount.,"[{'id': 9, 'is_business_ready_feature': False, 'is_present': True, 'is_safety_feature': False, 'name': 'Free parking on premises'}, {'id': 4, 'is_business_ready_feature': False, 'is_present': True, 'is_safety_feature': False, 'name': 'Wifi'}, {'id': 8, 'is_business_ready_feature': False, 'is_present': False, 'is_safety_feature': False, 'name': 'Kitchen'}, {'id': 47, 'is_business_ready_feature': True, 'is_present': True, 'is_safety_feature': False, 'name': 'Laptop friendly workspace'}, {'id': 44, 'is_business_ready_feature': True, 'is_present': True, 'is_safety_feature': False, 'name': 'Hangers'}, {'id': 34, 'is_business_ready_feature': False, 'is_present': True, 'is_safety_feature': False, 'name': 'Dryer'}, {'id': 1, 'is_business_ready_feature': False, 'is_present': False, 'is_safety_feature': False, 'name': 'TV'}, {'id': 46, 'is_business_ready_feature': True, 'is_present': True, 'is_safety_feature': False, 'name': 'Iron'}, {'id': 33, 'is_business_ready_feature': False, 'is_present': True, 'is_safety_feature': False, 'name': 'Washer'}, {'id': 45, 'is_business_ready_feature': True, 'is_present': True, 'is_safety_feature': False, 'name': 'Hair dryer'}, {'id': 41, 'is_business_ready_feature': False, 'is_present': True, 'is_safety_feature': False, 'name': 'Shampoo'}, {'id': 30, 'is_business_ready_feature': False, 'is_present': True, 'is_safety_feature': False, 'name': 'Heating'}, {'id': 40, 'is_business_ready_feature': False, 'is_present': True, 'is_safety_feature': False, 'name': 'Essentials'}, {'id': 5, 'is_business_ready_feature': False, 'is_present': False, 'is_safety_feature': False, 'name': 'Air conditioning'}, {'id': 23, 'is_business_ready_feature': False, 'is_present': True, 'is_safety_feature': False, 'name': 'Free street parking'}, {'id': 54, 'is_business_ready_feature': False, 'is_present': True, 'is_safety_feature': False, 'name': 'Lockbox'}, {'id': 57, 'is_business_ready_feature': False, 'is_present': True, 'is_safety_feature': False, 'name': 'Private entrance'}, {'id': 36, 'is_business_ready_feature': False, 'is_present': True, 'is_safety_feature': True, 'name': 'Carbon monoxide detector'}, {'id': 35, 'is_business_ready_feature': False, 'is_present': True, 'is_safety_feature': True, 'name': 'Smoke detector'}]","[{'type': 'LISTING_CHECKIN_REVIEW_RATING', 'message': '90% of recent guests gave the check-in process a 5-star rating.', 'headline': 'Great check-in experience'}, {'type': 'LISTING_SPARKLING_CLEAN', 'message': '9 recent guests said this place was sparkling clean.', 'headline': 'Sparkling clean'}, {'type': 'LISTING_SELF_CHECKIN', 'message': 'Check yourself in with the lockbox.', 'headline': 'Self check-in'}]","[{'type': 'security_deposit', 'title': 'Security Deposit - if you damage the home, you may be charged up to $250'}]",,"[{'category': 'accuracy', 'value': 10, 'localized_rating': '4.9', 'percentage': 0.9800000000000001}, {'category': 'communication', 'value': 10, 'localized_rating': '4.8', 'percentage': 0.962}, {'category': 'cleanliness', 'value': 9, 'localized_rating': '4.7', 'percentage': 0.932}, {'category': 'location', 'value': 10, 'localized_rating': '4.8', 'percentage': 0.9560000000000001}, {'category': 'checkin', 'value': 10, 'localized_rating': '4.8', 'percentage': 0.97}, {'category': 'value', 'value': 9, 'localized_rating': '4.7', 'percentage': 0.944}]","[{'localized_text': 'Quick responses', 'localized_count_string': '16'}, {'localized_text': 'Sparkling clean', 'localized_count_string': '11'}, {'localized_text': 'Outstanding hospitality', 'localized_count_string': '5'}, {'localized_text': 'Amazing amenities', 'localized_count_string': '5'}, {'localized_text': 'Stylish space', 'localized_count_string': '4'}]","{0: [{'quantity': 1, 'type': 'single_bed'}, {'quantity': 1, 'type': 'bunk_bed'}, {'quantity': 2, 'type': 'air_mattress'}], 1: [{'quantity': 1, 'type': 'queen_bed'}]}",126170335,True,False,April 2017,100%,within an hour,False,https://a0.muscache.com/im/pictures/user/c682cbf9-c5ce-4fad-96aa-87a34ff29708.jpg?aki_policy=profile_large,The whole floor will be for the guests use.,"You will have a private room and the whole floor to yourself. You will have your own bathroom and you will rarely see me unless I have to do laundry or if you have any needs.
There is also a private entrance for guest to use. Feel free to ask if there are any questions:).

The area is spacious, giving guest plenty of room to lay back and relax. It includes a private bathroom, laundry room, mini fridge, and microwave.

The whole floor will be for the guests use.

Close to public transportation. Takes about 20 minutes to go downtown by car. There’s also a public park that is about five minutes by walking.

Car or bus both are great there’s parking all around the house and the bus stop is right outside the house.

I would like guests to know that I do work and so there maybe times where I am not available to check guests in personally, but I do try to at least meet with guests once after they check in so that I can answer any questions.","Please let me know if you decide to have additional guest over if they are not listed in your initial booking. 

The part accessible to guest is the basement so it would be expected that the guest would not trespass onto the first and second floor. Also please close lights that are not in use. Thank you!",,Close to public transportation. Takes about 20 minutes to go downtown by car. There’s also a public park that is about five minutes by walking.,"I would like guests to know that I do work and so there maybe times where I am not available to check guests in personally, but I do try to at least meet with guests once after they check in so that I can answer any questions.","The area is spacious, giving guest plenty of room to lay back and relax. It includes a private bathroom, laundry room, mini fridge, and microwave.","You will have a private room and the whole floor to yourself. You will have your own bathroom and you will rarely see me unless I have to do laundry or if you have any needs.
There is also a private entrance for guest to use. Feel free to ask if there are any questions:).",Car or bus both are great there’s parking all around the house and the bus stop is right outside the house.,True,True,False,False,,True,False,35.0,"[{'milestones': {'titles': ['<b>Jan 11, 1:00PM</b>', 'Check-in'], 'subtitles': [], 'type': 'check_in'}, 'localized_cancellation_policy_name': 'Strict', 'cancellation_policy_label': 'strict_14_with_grace_period', 'cancellation_policy_price_type': None, 'cancellation_policy_price_factor': 0.0, 'cancellation_policy_id': 44, 'book_it_module_tooltip': 'After that, cancel before 1:00PM on Jan 4 and get a 50% refund, minus the service fee.', 'subtitle': 'After that, cancel before 1:00PM on Jan 4 and get a 50% refund, minus the service fee.'}]",0.0,5.0,3,2020-01-11,2020-01-13,2019-12-28,2019-11-14 21:43:16+00:00,2017-05-08 20:20:19+00:00
