"Quiet hours, 11pm on weekdays 12am on weekends",1 bath,2 beds,2 bedrooms,8 guests,40306032,Home Away From Home Apt.,8,9,Hugo,[],Entire apartment,entire_home,0,,1,False,False,2PM - 10PM,,41.94046,-87.75968,814.0,R19000050878,True,,0,0,,0,,,False,[],False,False,True,,,This host offers 20% off if you stay a week and a 40% monthly discount.,"[{'id': 4, 'is_business_ready_feature': False, 'is_present': True, 'is_safety_feature': False, 'name': 'Wifi'}, {'id': 8, 'is_business_ready_feature': False, 'is_present': True, 'is_safety_feature': False, 'name': 'Kitchen'}, {'id': 44, 'is_business_ready_feature': True, 'is_present': True, 'is_safety_feature': False, 'name': 'Hangers'}, {'id': 1, 'is_business_ready_feature': False, 'is_present': True, 'is_safety_feature': False, 'name': 'TV'}, {'id': 46, 'is_business_ready_feature': True, 'is_present': True, 'is_safety_feature': False, 'name': 'Iron'}, {'id': 33, 'is_business_ready_feature': False, 'is_present': False, 'is_safety_feature': False, 'name': 'Washer'}, {'id': 45, 'is_business_ready_feature': True, 'is_present': True, 'is_safety_feature': False, 'name': 'Hair dryer'}, {'id': 41, 'is_business_ready_feature': False, 'is_present': False, 'is_safety_feature': False, 'name': 'Shampoo'}, {'id': 30, 'is_business_ready_feature': False, 'is_present': True, 'is_safety_feature': False, 'name': 'Heating'}, {'id': 40, 'is_business_ready_feature': False, 'is_present': True, 'is_safety_feature': False, 'name': 'Essentials'}, {'id': 5, 'is_business_ready_feature': False, 'is_present': False, 'is_safety_feature': False, 'name': 'Air conditioning'}, {'id': 87, 'is_business_ready_feature': False, 'is_present': True, 'is_safety_feature': False, 'name': 'Ethernet connection'}, {'id': 77, 'is_business_ready_feature': False, 'is_present': True, 'is_safety_feature': False, 'name': 'Hot water'}, {'id': 61, 'is_business_ready_feature': False, 'is_present': True, 'is_safety_feature': False, 'name': 'Bathtub'}, {'id': 129, 'is_business_ready_feature': False, 'is_present': True, 'is_safety_feature': False, 'name': 'Host greets you'}, {'id': 57, 'is_business_ready_feature': False, 'is_present': True, 'is_safety_feature': False, 'name': 'Private entrance'}, {'id': 104, 'is_business_ready_feature': False, 'is_present': True, 'is_safety_feature': False, 'name': 'Long term stays allowed'}, {'id': 85, 'is_business_ready_feature': False, 'is_present': True, 'is_safety_feature': False, 'name': 'Bed linens'}, {'id': 39, 'is_business_ready_feature': False, 'is_present': True, 'is_safety_feature': True, 'name': 'Fire extinguisher'}, {'id': 36, 'is_business_ready_feature': False, 'is_present': True, 'is_safety_feature': True, 'name': 'Carbon monoxide detector'}, {'id': 35, 'is_business_ready_feature': False, 'is_present': True, 'is_safety_feature': True, 'name': 'Smoke detector'}]",,"[{'type': 'requires_stairs', 'title': 'Must climb stairs'}]",,,,"{1: [{'quantity': 1, 'type': 'queen_bed'}], 2: [{'quantity': 1, 'type': 'queen_bed'}, {'quantity': 1, 'type': 'air_mattress'}]}",136367605,True,False,June 2017,100%,within a few hours,False,https://a0.muscache.com/im/pictures/user/5ebc7b17-ef02-4185-9479-0ffdae26f2e9.jpg?aki_policy=profile_large,,"Peaceful and cozy apt. located on the NW side of the city in a quiet neighborhood. Short distance from the I90/94 highway. About 5 miles from Wrigleyville/boystown.

Perfect for 2 small families, or group of people but still have space an privacy

I live a 5min drive from this location and available when needed.

1 block away from Chopin Park and located in from of a Church, a few blocks walk from bus station that will also take u directly to the blue line train station.

If your are driving during your stay, you are located close to the highway that take u anywhere in the city. About 15-20mins from O’Hare airport.","Quiet hours, 11pm on weekdays 12am on weekends",I live a 5min drive from this location and available when needed.,"1 block away from Chopin Park and located in from of a Church, a few blocks walk from bus station that will also take u directly to the blue line train station.",,"Perfect for 2 small families, or group of people but still have space an privacy",Peaceful and cozy apt. located on the NW side of the city in a quiet neighborhood. Short distance from the I90/94 highway. About 5 miles from Wrigleyville/boystown.,"If your are driving during your stay, you are located close to the highway that take u anywhere in the city. About 15-20mins from O’Hare airport.",True,True,False,False,,True,False,65.0,"[{'milestones': {'titles': ['<b>Jan 11, 2:00PM</b>', 'Check-in'], 'subtitles': [], 'type': 'check_in'}, 'localized_cancellation_policy_name': 'Flexible', 'cancellation_policy_label': 'flexible', 'cancellation_policy_price_type': None, 'cancellation_policy_price_factor': 0.0, 'cancellation_policy_id': 3, 'book_it_module_tooltip': 'Free cancellation for 48 hours', 'subtitle': 'After that, cancel before 2:00PM on Jan 10 and get a full refund, minus the service fee.'}]",0.0,0.0,0,2020-01-11,2020-01-12,2019-12-28,,
,1 bath,2 beds,2 bedrooms,4 guests,31392287,Centrally located Stylish apt in West Humbolt Park,4,9,Randy,['English'],Entire apartment,entire_home,0,,2,False,False,After 3PM,11AM,41.90041,-87.71759,902.0,R19000049468,True,,0,1,,1,,,False,[],False,False,True,,,This host offers 10% off if you stay a week and a 31% monthly discount.,"[{'id': 4, 'is_business_ready_feature': False, 'is_present': True, 'is_safety_feature': False, 'name': 'Wifi'}, {'id': 8, 'is_business_ready_feature': False, 'is_present': True, 'is_safety_feature': False, 'name': 'Kitchen'}, {'id': 27, 'is_business_ready_feature': False, 'is_present': True, 'is_safety_feature': False, 'name': 'Indoor fireplace'}, {'id': 2, 'is_business_ready_feature': False, 'is_present': True, 'is_safety_feature': False, 'name': 'Cable TV'}, {'id': 47, 'is_business_ready_feature': True, 'is_present': True, 'is_safety_feature': False, 'name': 'Laptop friendly workspace'}, {'id': 44, 'is_business_ready_feature': True, 'is_present': True, 'is_safety_feature': False, 'name': 'Hangers'}, {'id': 1, 'is_business_ready_feature': False, 'is_present': True, 'is_safety_feature': False, 'name': 'TV'}, {'id': 46, 'is_business_ready_feature': True, 'is_present': True, 'is_safety_feature': False, 'name': 'Iron'}, {'id': 33, 'is_business_ready_feature': False, 'is_present': False, 'is_safety_feature': False, 'name': 'Washer'}, {'id': 45, 'is_business_ready_feature': True, 'is_present': True, 'is_safety_feature': False, 'name': 'Hair dryer'}, {'id': 41, 'is_business_ready_feature': False, 'is_present': True, 'is_safety_feature': False, 'name': 'Shampoo'}, {'id': 30, 'is_business_ready_feature': False, 'is_present': True, 'is_safety_feature': False, 'name': 'Heating'}, {'id': 40, 'is_business_ready_feature': False, 'is_present': True, 'is_safety_feature': False, 'name': 'Essentials'}, {'id': 5, 'is_business_ready_feature': False, 'is_present': False, 'is_safety_feature': False, 'name': 'Air conditioning'}, {'id': 77, 'is_business_ready_feature': False, 'is_present': True, 'is_safety_feature': False, 'name': 'Hot water'}, {'id': 23, 'is_business_ready_feature': False, 'is_present': True, 'is_safety_feature': False, 'name': 'Free street parking'}, {'id': 90, 'is_business_ready_feature': False, 'is_present': True, 'is_safety_feature': False, 'name': 'Coffee maker'}, {'id': 94, 'is_business_ready_feature': False, 'is_present': True, 'is_safety_feature': False, 'name': 'Cooking basics'}, {'id': 93, 'is_business_ready_feature': False, 'is_present': True, 'is_safety_feature': False, 'name': 'Dishes and silverware'}, {'id': 89, 'is_business_ready_feature': False, 'is_present': True, 'is_safety_feature': False, 'name': 'Microwave'}, {'id': 91, 'is_business_ready_feature': False, 'is_present': True, 'is_safety_feature': False, 'name': 'Refrigerator'}, {'id': 95, 'is_business_ready_feature': False, 'is_present': True, 'is_safety_feature': False, 'name': 'Oven'}, {'id': 96, 'is_business_ready_feature': False, 'is_present': True, 'is_safety_feature': False, 'name': 'Stove'}, {'id': 57, 'is_business_ready_feature': False, 'is_present': False, 'is_safety_feature': False, 'name': 'Private entrance'}, {'id': 104, 'is_business_ready_feature': False, 'is_present': True, 'is_safety_feature': False, 'name': 'Long term stays allowed'}, {'id': 85, 'is_business_ready_feature': False, 'is_present': True, 'is_safety_feature': False, 'name': 'Bed linens'}, {'id': 100, 'is_business_ready_feature': False, 'is_present': True, 'is_safety_feature': False, 'name': 'Patio or balcony'}, {'id': 101, 'is_business_ready_feature': False, 'is_present': True, 'is_safety_feature': False, 'name': 'Garden or backyard'}, {'id': 39, 'is_business_ready_feature': False, 'is_present': True, 'is_safety_feature': True, 'name': 'Fire extinguisher'}, {'id': 36, 'is_business_ready_feature': False, 'is_present': True, 'is_safety_feature': True, 'name': 'Carbon monoxide detector'}, {'id': 35, 'is_business_ready_feature': False, 'is_present': True, 'is_safety_feature': True, 'name': 'Smoke detector'}, {'id': 37, 'is_business_ready_feature': False, 'is_present': True, 'is_safety_feature': True, 'name': 'First aid kit'}]",,"[{'type': 'has_pets', 'title': 'Pet(s) live on property'}, {'type': 'potential_noise', 'title': 'Potential for noise'}, {'type': 'requires_stairs', 'title': 'Must climb stairs'}, {'type': 'surveillance', 'title': 'Surveillance or recording devices on property'}]",,,,"{1: [{'quantity': 1, 'type': 'queen_bed'}], 2: [{'quantity': 1, 'type': 'queen_bed'}]}",68970675,True,False,April 2016,83%,within a day,False,https://a0.muscache.com/im/pictures/user/f905b632-e276-4861-9de8-bf6337e348f8.jpg?aki_policy=profile_large,,"This unit is located in a vibrant neighborhood filled with diversity. This jewel is located near public transit where you can hop right on the train and be downtown Chicago in less than 15mins. This modest apartment is situated in a 8 unit building. It will host a weekend getaway with your significant other and is spacious enough to have the family coming in town to vist for the holidays.

This space is trendy with an Urban flair. It is located near the pulse of everything. You are about 30mins from either Ohare or Midway. You are less the 7 miles from downtown. There is public transportation within walking distance. You are a $10 Uber or Lift ride from ""The Chicago Bean and Grant Park""

Apart from the obvious attraction of the acres of green recreational space offered by the parks, West Humboldt Park is also bordered by Garfield Conservatory and the coming Bloomingdale Trail – a proposed two mile elevated, multi-use, linear park and trail. New educational institutions include Rowe Clark Math and Science Academy, the newly renovated state of the art Westinghouse High School and the Richard M. Daley Library. Hargrove Hospital recently completed a $25 million renovation of Garfield Hospital, providing both jobs for community residents and mental health services for troubled youth. Iconic local businesses include: Roeser’s Bakery, Jimmy’s Red Hots, Rosa’s Lounge blues club on Armitage, and Headlines Barbershop, along with newcomers on Chicago Avenue – Brother-In-Law Ribs and Turkey Chop Gourmet Grill – and Inspiration Kitchen on Lake Street. Residents also enjoy local festivals such as the yearly African Cultural Fest in Kells Park, now in its sixth year, and the Saturday West Humboldt Park Farmers Markets in the NHS parking lot at the corner of Chicago and Central Park, now in its fourth year.

You are walking distance to public transportation. A $10 Uber or Lyft right downtown about a $30 dollar Uber/Lyft from Ohare and abour 25 from Midway.",,,"Apart from the obvious attraction of the acres of green recreational space offered by the parks, West Humboldt Park is also bordered by Garfield Conservatory and the coming Bloomingdale Trail – a proposed two mile elevated, multi-use, linear park and trail. New educational institutions include Rowe Clark Math and Science Academy, the newly renovated state of the art Westinghouse High School and the Richard M. Daley Library. Hargrove Hospital recently completed a $25 million renovation of Garfield Hospital, providing both jobs for community residents and mental health services for troubled youth. Iconic local businesses include: Roeser’s Bakery, Jimmy’s Red Hots, Rosa’s Lounge blues club on Armitage, and Headlines Barbershop, along with newcomers on Chicago Avenue – Brother-In-Law Ribs and Turkey Chop Gourmet Grill – and Inspiration Kitchen on Lake Street. Residents also enjoy local festivals such as the yearly African Cultural Fest in Kells Park, now in its sixth year, and the Saturday West Humboldt Park Farmers Markets in the NHS parking lot at the corner of Chicago and Central Park, now in its fourth year.",,"This space is trendy with an Urban flair. It is located near the pulse of everything. You are about 30mins from either Ohare or Midway. You are less the 7 miles from downtown. There is public transportation within walking distance. You are a $10 Uber or Lift ride from ""The Chicago Bean and Grant Park""",This unit is located in a vibrant neighborhood filled with diversity. This jewel is located near public transit where you can hop right on the train and be downtown Chicago in less than 15mins. This modest apartment is situated in a 8 unit building. It will host a weekend getaway with your significant other and is spacious enough to have the family coming in town to vist for the holidays.,You are walking distance to public transportation. A $10 Uber or Lyft right downtown about a $30 dollar Uber/Lyft from Ohare and abour 25 from Midway.,True,True,False,False,,True,False,75.0,"[{'milestones': {'titles': ['<b>Jan 11, 3:00PM</b>', 'Check-in'], 'subtitles': [], 'type': 'check_in'}, 'localized_cancellation_policy_name': 'Non-refundable', 'cancellation_policy_label': 'tiered_pricing_non_refundable', 'cancellation_policy_price_type': 'TIERED_PRICING_STANDARD', 'cancellation_policy_price_factor': -0.1, 'cancellation_policy_id': 51, 'book_it_module_tooltip': 'Cancel before 3:00PM on Jan 11 and only get a refund of the cleaning fee.', 'subtitle': 'Cancel before 3:00PM on Jan 11 and only get a refund of the cleaning fee.'}, {'milestones': {'titles': ['<b>Jan 11, 3:00PM</b>', 'Check-in'], 'subtitles': [], 'type': 'check_in'}, 'localized_cancellation_policy_name': 'Refundable', 'cancellation_policy_label': 'moderate', 'cancellation_policy_price_type': 'TIERED_PRICING_FLEXIBLE', 'cancellation_policy_price_factor': 0.0, 'cancellation_policy_id': 4, 'book_it_module_tooltip': 'Free cancellation for 48 hours', 'subtitle': 'After that, cancel before 3:00PM on Jan 6 and get a full refund, minus the service fee.'}]",-0.1,0.0,0,2020-01-11,2020-01-13,2019-12-28,2019-10-18 19:48:21+00:00,2019-10-18 19:48:21+00:00
"Quiet hours from 10pm-8am
• I like to keep a shoe-free home.
• I enjoy offering flexible check-in and check-out times, however if you wish to check-in before 2pm please note I cannot always guarantee a clean bed will be immediately available due to the time it takes to clean and put on fresh linens. You are welcome to use the other rooms in the house or drop off your belongings until your bed is ready. Likewise if you wish to check out after noon you will need to move your belongings out of the bedroom at that time so we can clean and change the sheets.
*There is an additional charge of $25 per night if any guests will be sleeping outside the guest bedroom.
ANY TYPE OF WEAPON IS EXPRESSLY FORBIDDEN",1 shared bath,1 bed,1 bedroom,2 guests,14057684,"Sunny Large Apartment, Near Beautiful Public Pool",2,12,Susan,['English'],Private room in apartment,private_room,0,,2,False,False,After 2PM,12PM (noon),41.88954,-87.6604,1393.0,R17000013569,True,False,3,172,96,172,,,False,[],False,False,True,,4.82,This host offers 8% off if you stay a week and a 15% monthly discount.,"[{'id': 4, 'is_business_ready_feature': False, 'is_present': True, 'is_safety_feature': False, 'name': 'Wifi'}, {'id': 8, 'is_business_ready_feature': False, 'is_present': True, 'is_safety_feature': False, 'name': 'Kitchen'}, {'id': 47, 'is_business_ready_feature': True, 'is_present': True, 'is_safety_feature': False, 'name': 'Laptop friendly workspace'}, {'id': 44, 'is_business_ready_feature': True, 'is_present': True, 'is_safety_feature': False, 'name': 'Hangers'}, {'id': 34, 'is_business_ready_feature': False, 'is_present': True, 'is_safety_feature': False, 'name': 'Dryer'}, {'id': 1, 'is_business_ready_feature': False, 'is_present': True, 'is_safety_feature': False, 'name': 'TV'}, {'id': 46, 'is_business_ready_feature': True, 'is_present': True, 'is_safety_feature': False, 'name': 'Iron'}, {'id': 33, 'is_business_ready_feature': False, 'is_present': True, 'is_safety_feature': False, 'name': 'Washer'}, {'id': 45, 'is_business_ready_feature': True, 'is_present': True, 'is_safety_feature': False, 'name': 'Hair dryer'}, {'id': 41, 'is_business_ready_feature': False, 'is_present': True, 'is_safety_feature': False, 'name': 'Shampoo'}, {'id': 30, 'is_business_ready_feature': False, 'is_present': True, 'is_safety_feature': False, 'name': 'Heating'}, {'id': 40, 'is_business_ready_feature': False, 'is_present': True, 'is_safety_feature': False, 'name': 'Essentials'}, {'id': 5, 'is_business_ready_feature': False, 'is_present': True, 'is_safety_feature': False, 'name': 'Air conditioning'}, {'id': 77, 'is_business_ready_feature': False, 'is_present': True, 'is_safety_feature': False, 'name': 'Hot water'}, {'id': 23, 'is_business_ready_feature': False, 'is_present': True, 'is_safety_feature': False, 'name': 'Free street parking'}, {'id': 90, 'is_business_ready_feature': False, 'is_present': True, 'is_safety_feature': False, 'name': 'Coffee maker'}, {'id': 94, 'is_business_ready_feature': False, 'is_present': True, 'is_safety_feature': False, 'name': 'Cooking basics'}, {'id': 93, 'is_business_ready_feature': False, 'is_present': True, 'is_safety_feature': False, 'name': 'Dishes and silverware'}, {'id': 92, 'is_business_ready_feature': False, 'is_present': True, 'is_safety_feature': False, 'name': 'Dishwasher'}, {'id': 89, 'is_business_ready_feature': False, 'is_present': True, 'is_safety_feature': False, 'name': 'Microwave'}, {'id': 91, 'is_business_ready_feature': False, 'is_present': True, 'is_safety_feature': False, 'name': 'Refrigerator'}, {'id': 95, 'is_business_ready_feature': False, 'is_present': True, 'is_safety_feature': False, 'name': 'Oven'}, {'id': 96, 'is_business_ready_feature': False, 'is_present': True, 'is_safety_feature': False, 'name': 'Stove'}, {'id': 129, 'is_business_ready_feature': False, 'is_present': True, 'is_safety_feature': False, 'name': 'Host greets you'}, {'id': 57, 'is_business_ready_feature': False, 'is_present': False, 'is_safety_feature': False, 'name': 'Private entrance'}, {'id': 85, 'is_business_ready_feature': False, 'is_present': True, 'is_safety_feature': False, 'name': 'Bed linens'}, {'id': 86, 'is_business_ready_feature': False, 'is_present': True, 'is_safety_feature': False, 'name': 'Extra pillows and blankets'}, {'id': 42, 'is_business_ready_feature': False, 'is_present': True, 'is_safety_feature': True, 'name': 'Lock on bedroom door'}, {'id': 39, 'is_business_ready_feature': False, 'is_present': True, 'is_safety_feature': True, 'name': 'Fire extinguisher'}, {'id': 36, 'is_business_ready_feature': False, 'is_present': True, 'is_safety_feature': True, 'name': 'Carbon monoxide detector'}, {'id': 35, 'is_business_ready_feature': False, 'is_present': True, 'is_safety_feature': True, 'name': 'Smoke detector'}, {'id': 37, 'is_business_ready_feature': False, 'is_present': True, 'is_safety_feature': True, 'name': 'First aid kit'}]","[{'type': 'LISTING_CHECKIN_REVIEW_RATING', 'message': '95% of recent guests gave the check-in process a 5-star rating.', 'headline': 'Great check-in experience'}, {'type': 'LISTING_LOCATION_REVIEW_RATING', 'message': '95% of recent guests gave the location a 5-star rating.', 'headline': 'Great location'}, {'type': 'LISTING_SUPER_HOST', 'message': 'Superhosts are experienced, highly rated hosts who are committed to providing great stays for guests.', 'headline': 'Susan is a Superhost'}]","[{'type': 'has_pets', 'title': 'Pet(s) live on property'}, {'type': 'limited_parking', 'title': 'No parking on property'}, {'type': 'requires_stairs', 'title': 'Must climb stairs'}, {'type': 'security_deposit', 'title': 'Security Deposit - if you damage the home, you may be charged up to $100'}, {'type': 'surveillance', 'title': 'Surveillance or recording devices on property'}]",,"[{'category': 'accuracy', 'value': 10, 'localized_rating': '4.9', 'percentage': 0.982}, {'category': 'communication', 'value': 10, 'localized_rating': '4.9', 'percentage': 0.9880000000000001}, {'category': 'cleanliness', 'value': 10, 'localized_rating': '4.7', 'percentage': 0.944}, {'category': 'location', 'value': 10, 'localized_rating': '4.8', 'percentage': 0.9640000000000001}, {'category': 'checkin', 'value': 10, 'localized_rating': '4.9', 'percentage': 0.986}, {'category': 'value', 'value': 10, 'localized_rating': '4.9', 'percentage': 0.978}]","[{'localized_text': 'Outstanding hospitality', 'localized_count_string': '36'}, {'localized_text': 'Quick responses', 'localized_count_string': '32'}, {'localized_text': 'Sparkling clean', 'localized_count_string': '20'}, {'localized_text': 'Amazing amenities', 'localized_count_string': '18'}, {'localized_text': 'Stylish space', 'localized_count_string': '15'}]","{1: [{'quantity': 1, 'type': 'queen_bed'}]}",233562,True,True,September 2010,100%,within a day,False,https://a0.muscache.com/im/users/233562/profile_pic/1421113266/original.jpg?aki_policy=profile_large,Access to the entire apartment.,"My place is close to tons of great restaurants, parks and pools. Very close to Downtown 'Magnificent Mile' and the West Loop. Easy transportation to Wicker Park, South Loop and the Sears Tower (Chicagoans refuse to call it Willis Tower). Good for couples, solo adventurers, business travelers. Very close to #65 Grand bus. Near #66 Chicago bus, Blue and Green line 'L'.

Free laundry in the basement.

Access to the entire apartment.

I work full time as a veterinary nurse but am home some evenings. 
My partner, Benjamin, will sometimes spend the night.

Getting to any corner of the city is convenient

There is one cat that lives in the home, the litter boxes are not inside the apartment. I live next to a commercial food facility and the 'beep' of the trucks can be heard as they back up early in the morning for deliveries. This is only an issue on some weekday mornings. I like to let anyone staying on a weekday know.","Quiet hours from 10pm-8am
• I like to keep a shoe-free home.
• I enjoy offering flexible check-in and check-out times, however if you wish to check-in before 2pm please note I cannot always guarantee a clean bed will be immediately available due to the time it takes to clean and put on fresh linens. You are welcome to use the other rooms in the house or drop off your belongings until your bed is ready. Likewise if you wish to check out after noon you will need to move your belongings out of the bedroom at that time so we can clean and change the sheets.
*There is an additional charge of $25 per night if any guests will be sleeping outside the guest bedroom.
ANY TYPE OF WEAPON IS EXPRESSLY FORBIDDEN","I work full time as a veterinary nurse but am home some evenings. 
My partner, Benjamin, will sometimes spend the night.",,"There is one cat that lives in the home, the litter boxes are not inside the apartment. I live next to a commercial food facility and the 'beep' of the trucks can be heard as they back up early in the morning for deliveries. This is only an issue on some weekday mornings. I like to let anyone staying on a weekday know.",Free laundry in the basement.,"My place is close to tons of great restaurants, parks and pools. Very close to Downtown 'Magnificent Mile' and the West Loop. Easy transportation to Wicker Park, South Loop and the Sears Tower (Chicagoans refuse to call it Willis Tower). Good for couples, solo adventurers, business travelers. Very close to #65 Grand bus. Near #66 Chicago bus, Blue and Green line 'L'.",Getting to any corner of the city is convenient,False,False,False,False,,True,False,20.0,"[{'milestones': {'titles': ['<b>Jan 11, 2:00PM</b>', 'Check-in'], 'subtitles': [], 'type': 'check_in'}, 'localized_cancellation_policy_name': 'Flexible', 'cancellation_policy_label': 'flexible', 'cancellation_policy_price_type': None, 'cancellation_policy_price_factor': 0.0, 'cancellation_policy_id': 3, 'book_it_module_tooltip': 'Free cancellation for 48 hours', 'subtitle': 'After that, cancel before 2:00PM on Jan 10 and get a full refund, minus the service fee.'}]",0.0,0.0,0,2020-01-11,2020-01-13,2019-12-28,2019-12-20 19:45:47+00:00,2016-07-18 23:08:06+00:00
