additional_house_rules,bathroom_label,bed_label,bedroom_label,guest_label,id,name,person_capacity,photo_count,host_name,languages,room_and_property_type,room_type_category,tier_id,calendar_last_updated_at,min_nights,has_we_work_location,is_business_travel_ready,localized_check_in_time_window,localized_check_out_time,lat,lng,neighborhood_id,license,requires_license,support_cleaner_living_wage,host_other_property_review_count,listing_review_count,listing_review_score,visible_review_count,host_interaction,host_quote,is_select_market,nearby_airport_distance_descriptions,is_hotel,is_representative_inventory,has_essentials_amenity,security_deposit_details,localized_overall_rating,discount_phrase,amenities,highlights,expectations,additional_hosts,review_summaries,appreciation_tags,rooms,host_id,host_identity_verified,host_is_superhost,host_member_since,host_response_rate_without_na,host_response_time_without_na,host_has_inclusion_badge,host_profile_pic_path_large,access,description,house_rules,interaction,neighborhood_overview,notes,space,summary,transit,allows_children,allows_infants,allows_smoking,allows_events,host_check_in_time_message,allows_non_china_users,is_plus,cleaning_fee,cancelation_policies,non_refundable_discount_rate,extra_guest_fee,extra_guess_fee_at_greater_than,check_in,check_out,date_gathered,newest_reviews_date,oldest_reviews_date
,1 bath,2 beds,Studio,4 guests,37393397,King Bed Getaway w/ Pool near Navy Pier,4,17,Edwin,"['中文 (简体)', 'English', 'Français', 'Italiano', '日本語', 'Português', 'Русский', 'Español']",Entire apartment,entire_home,0,,2,False,False,3PM - 12AM (midnight),10AM,41.88487,-87.62554,915.0,City registration pending,True,,24,0,,0,,,False,[],False,False,True,,,,"[{'id': 7, 'is_business_ready_feature': False, 'is_present': True, 'is_safety_feature': False, 'name': 'Pool'}, {'id': 4, 'is_business_ready_feature': False, 'is_present': True, 'is_safety_feature': False, 'name': 'Wifi'}, {'id': 8, 'is_business_ready_feature': False, 'is_present': True, 'is_safety_feature': False, 'name': 'Kitchen'}, {'id': 15, 'is_business_ready_feature': False, 'is_present': True, 'is_safety_feature': False, 'name': 'Gym'}, {'id': 47, 'is_business_ready_feature': True, 'is_present': True, 'is_safety_feature': False, 'name': 'Laptop friendly workspace'}, {'id': 44, 'is_business_ready_feature': True, 'is_present': True, 'is_safety_feature': False, 'name': 'Hangers'}, {'id': 1, 'is_business_ready_feature': False, 'is_present': True, 'is_safety_feature': False, 'name': 'TV'}, {'id': 46, 'is_business_ready_feature': True, 'is_present': True, 'is_safety_feature': False, 'name': 'Iron'}, {'id': 33, 'is_business_ready_feature': False, 'is_present': False, 'is_safety_feature': False, 'name': 'Washer'}, {'id': 45, 'is_business_ready_feature': True, 'is_present': True, 'is_safety_feature': False, 'name': 'Hair dryer'}, {'id': 41, 'is_business_ready_feature': False, 'is_present': True, 'is_safety_feature': False, 'name': 'Shampoo'}, {'id': 30, 'is_business_ready_feature': False, 'is_present': True, 'is_safety_feature': False, 'name': 'Heating'}, {'id': 40, 'is_business_ready_feature': False, 'is_present': True, 'is_safety_feature': False, 'name': 'Essentials'}, {'id': 5, 'is_business_ready_feature': False, 'is_present': True, 'is_safety_feature': False, 'name': 'Air conditioning'}, {'id': 77, 'is_business_ready_feature': False, 'is_present': True, 'is_safety_feature': False, 'name': 'Hot water'}, {'id': 90, 'is_business_ready_feature': False, 'is_present': True, 'is_safety_feature': False, 'name': 'Coffee maker'}, {'id': 94, 'is_business_ready_feature': False, 'is_present': True, 'is_safety_feature': False, 'name': 'Cooking basics'}, {'id': 93, 'is_business_ready_feature': False, 'is_present': True, 'is_safety_feature': False, 'name': 'Dishes and silverware'}, {'id': 92, 'is_business_ready_feature': False, 'is_present': True, 'is_safety_feature': False, 'name': 'Dishwasher'}, {'id': 89, 'is_business_ready_feature': False, 'is_present': True, 'is_safety_feature': False, 'name': 'Microwave'}, {'id': 91, 'is_business_ready_feature': False, 'is_present': True, 'is_safety_feature': False, 'name': 'Refrigerator'}, {'id': 95, 'is_business_ready_feature': False, 'is_present': True, 'is_safety_feature': False, 'name': 'Oven'}, {'id': 96, 'is_business_ready_feature': False, 'is_present': True, 'is_safety_feature': False, 'name': 'Stove'}, {'id': 57, 'is_business_ready_feature': False, 'is_present': False, 'is_safety_feature': False, 'name': 'Private entrance'}, {'id': 85, 'is_business_ready_feature': False, 'is_present': True, 'is_safety_feature': False, 'name': 'Bed linens'}, {'id': 86, 'is_business_ready_feature': False, 'is_present': True, 'is_safety_feature': False, 'name': 'Extra pillows and blankets'}, {'id': 39, 'is_business_ready_feature': False, 'is_present': True, 'is_safety_feature': True, 'name': 'Fire extinguisher'}, {'id': 36, 'is_business_ready_feature': False, 'is_present': True, 'is_safety_feature': True, 'name': 'Carbon monoxide detector'}, {'id': 35, 'is_business_ready_feature': False, 'is_present': True, 'is_safety_feature': True, 'name': 'Smoke detector'}, {'id': 37, 'is_business_ready_feature': False, 'is_present': True, 'is_safety_feature': True, 'name': 'First aid kit'}]","[{'type': 'LISTING_EXPERIENCED_HOST', 'message': 'Edwin has 24 reviews for other places.', 'headline': 'Experienced host'}, {'type': 'LISTING_OUTSTANDING_HOSPITALITY', 'message': '5 recent guests complimented Edwin for outstanding hospitality.', 'headline': 'Outstanding hospitality'}]",,,,,"{0: [{'quantity': 1, 'type': 'sofa_bed'}, {'quantity': 1, 'type': 'single_bed'}]}",162586833,True,False,December 2017,100%,within an hour,False,https://a0.muscache.com/im/pictures/user/d41ba4a0-a199-4f2d-a856-95e449f8170d.jpg?aki_policy=profile_large,"Guests can use the private space of the entire studio as well and common building areas, including the fitness center.","Located at the epicenter of Chicago's cultural, historical, and business attractions, this luxurious studio offers guests all the comforts of home, whether on the road for work or relax. 
You will be a walking distance of world famous attractions including: Millennium Park, the Bean, Navy Pier and Riverwalk. 
Enjoy our amazing amenities to provide you the best stay possible, including complete kitchen, equipped bathroom, king sized bed, TV with Netflix and Wi-Fi in all area.

The apartment is located in a unique neighborhood and has everything you need for an amazing time visiting Chicago. 
The studio is solely for our guests. It is a beautiful open space including a comfy sitting area, where you can rest on the sofa and watch a big TV with streaming platform installed as Netflix. Also, has a cozy sleeping area including a king size bed, comfort pillows and blankets, a a private and complete bathroom, equipped with a bathtub shower: you'll find body soap, shampoo & conditioner, a hair dryer and towels available for your use.
All area has high-speed Wi-Fi if you're travelling on business. Don't worry to miss anything.

Our AC/ Heating unit allows controlled temperature of the space. With a remote control you'll be able to set your desired temperature.

Guests can use the private space of the entire studio as well and common building areas, including the fitness center.

We do our best to tailor each experience to our guests preferences. Want advice, suggestions, or a shoulder to lean on? We are always available and at your disposal.

Due to our central location, whether it is nightlife or family activities, is just a quick journey. A variety of michelin restaurants, bars and grocery stores are just a few steps from the building.",,"We do our best to tailor each experience to our guests preferences. Want advice, suggestions, or a shoulder to lean on? We are always available and at your disposal.",,"Due to our central location, whether it is nightlife or family activities, is just a quick journey. A variety of michelin restaurants, bars and grocery stores are just a few steps from the building.","The apartment is located in a unique neighborhood and has everything you need for an amazing time visiting Chicago. 
The studio is solely for our guests. It is a beautiful open space including a comfy sitting area, where you can rest on the sofa and watch a big TV with streaming platform installed as Netflix. Also, has a cozy sleeping area including a king size bed, comfort pillows and blankets, a a private and complete bathroom, equipped with a bathtub shower: you'll find body soap, shampoo & conditioner, a hair dryer and towels available for your use.
All area has high-speed Wi-Fi if you're travelling on business. Don't worry to miss anything.

Our AC/ Heating unit allows controlled temperature of the space. With a remote control you'll be able to set your desired temperature.","Located at the epicenter of Chicago's cultural, historical, and business attractions, this luxurious studio offers guests all the comforts of home, whether on the road for work or relax. 
You will be a walking distance of world famous attractions including: Millennium Park, the Bean, Navy Pier and Riverwalk. 
Enjoy our amazing amenities to provide you the best stay possible, including complete kitchen, equipped bathroom, king sized bed, TV with Netflix and Wi-Fi in all area.",,True,True,False,False,,True,False,45.0,"[{'milestones': {'titles': ['<b>Jan 11, 3:00PM</b>', 'Check-in'], 'subtitles': [], 'type': 'check_in'}, 'localized_cancellation_policy_name': 'Strict', 'cancellation_policy_label': 'strict_14_with_grace_period', 'cancellation_policy_price_type': None, 'cancellation_policy_price_factor': 0.0, 'cancellation_policy_id': 44, 'book_it_module_tooltip': 'After that, cancel before 3:00PM on Jan 4 and get a 50% refund, minus the service fee.', 'subtitle': 'After that, cancel before 3:00PM on Jan 4 and get a 50% refund, minus the service fee.'}]",0.0,0.0,0,2020-01-11,2020-01-13,2019-12-28,,
,1.5 shared baths,1 bed,Studio,1 guest,19434785,Quaint home on a quiet street.,1,9,Kathleen,[],Private room in house,private_room,0,,7,False,False,After 3PM,11AM,41.87257,-87.79681,,,False,,0,4,100.0,4,,,False,[],False,False,True,,5.0,This host offers 7% off if you stay a week and a 10% monthly discount.,"[{'id': 9, 'is_business_ready_feature': False, 'is_present': True, 'is_safety_feature': False, 'name': 'Free parking on premises'}, {'id': 4, 'is_business_ready_feature': False, 'is_present': True, 'is_safety_feature': False, 'name': 'Wifi'}, {'id': 8, 'is_business_ready_feature': False, 'is_present': True, 'is_safety_feature': False, 'name': 'Kitchen'}, {'id': 2, 'is_business_ready_feature': False, 'is_present': True, 'is_safety_feature': False, 'name': 'Cable TV'}, {'id': 47, 'is_business_ready_feature': True, 'is_present': True, 'is_safety_feature': False, 'name': 'Laptop friendly workspace'}, {'id': 44, 'is_business_ready_feature': True, 'is_present': True, 'is_safety_feature': False, 'name': 'Hangers'}, {'id': 34, 'is_business_ready_feature': False, 'is_present': True, 'is_safety_feature': False, 'name': 'Dryer'}, {'id': 1, 'is_business_ready_feature': False, 'is_present': True, 'is_safety_feature': False, 'name': 'TV'}, {'id': 33, 'is_business_ready_feature': False, 'is_present': True, 'is_safety_feature': False, 'name': 'Washer'}, {'id': 45, 'is_business_ready_feature': True, 'is_present': True, 'is_safety_feature': False, 'name': 'Hair dryer'}, {'id': 41, 'is_business_ready_feature': False, 'is_present': False, 'is_safety_feature': False, 'name': 'Shampoo'}, {'id': 30, 'is_business_ready_feature': False, 'is_present': True, 'is_safety_feature': False, 'name': 'Heating'}, {'id': 40, 'is_business_ready_feature': False, 'is_present': True, 'is_safety_feature': False, 'name': 'Essentials'}, {'id': 5, 'is_business_ready_feature': False, 'is_present': True, 'is_safety_feature': False, 'name': 'Air conditioning'}, {'id': 61, 'is_business_ready_feature': False, 'is_present': True, 'is_safety_feature': False, 'name': 'Bathtub'}, {'id': 75, 'is_business_ready_feature': False, 'is_present': True, 'is_safety_feature': False, 'name': 'Game console'}, {'id': 57, 'is_business_ready_feature': False, 'is_present': True, 'is_safety_feature': False, 'name': 'Private entrance'}, {'id': 39, 'is_business_ready_feature': False, 'is_present': True, 'is_safety_feature': True, 'name': 'Fire extinguisher'}, {'id': 36, 'is_business_ready_feature': False, 'is_present': True, 'is_safety_feature': True, 'name': 'Carbon monoxide detector'}, {'id': 35, 'is_business_ready_feature': False, 'is_present': True, 'is_safety_feature': True, 'name': 'Smoke detector'}, {'id': 37, 'is_business_ready_feature': False, 'is_present': True, 'is_safety_feature': True, 'name': 'First aid kit'}]",,,,"[{'category': 'accuracy', 'value': 10, 'localized_rating': '5.0', 'percentage': 1.0}, {'category': 'communication', 'value': 10, 'localized_rating': '5.0', 'percentage': 1.0}, {'category': 'cleanliness', 'value': 9, 'localized_rating': '4.7', 'percentage': 0.9339999999999999}, {'category': 'location', 'value': 10, 'localized_rating': '5.0', 'percentage': 1.0}, {'category': 'checkin', 'value': 10, 'localized_rating': '5.0', 'percentage': 1.0}, {'category': 'value', 'value': 9, 'localized_rating': '4.5', 'percentage': 0.9}]",,"{0: [{'quantity': 2, 'type': 'single_bed'}]}",136250408,True,False,June 2017,33%,a few days or more,False,https://a0.muscache.com/im/pictures/user/0844c793-5eb0-4f03-ad6a-a21f4243c957.jpg?aki_policy=profile_large,We have two decks for outside relaxation.  Feel free to use our kitchen & laundry.,"Bright clean spacious home in the heart of Oak Park 2 minute walk to the Blue line and Oak Park Ave bus line.

Great location, close to shops, and transportation.  We live in a quiet street and summer is an ideal time to enjoy our home & Oak Park!

We have two decks for outside relaxation.  Feel free to use our kitchen & laundry.

We welcome the chance to interact with guests but aren't home all that much.  Comfortable too if guests want to keep to themselves, we are pretty easy going!

Diverse neighborhood, with great shopping, cafes, restaurants, parks and architecture!
Close enough to the city for easy access but far enough away to relax!

We have bikes here, train and busses around the corner & UBER easily available.  We have parking but it's a quick walk to many great local spots!

Spend the summer in our lovely home, walk to the nearby public pool, take in one of the many festivals or jump on a train to the city!! It's the best of both worlds!",,"We welcome the chance to interact with guests but aren't home all that much.  Comfortable too if guests want to keep to themselves, we are pretty easy going!","Diverse neighborhood, with great shopping, cafes, restaurants, parks and architecture!
Close enough to the city for easy access but far enough away to relax!","Spend the summer in our lovely home, walk to the nearby public pool, take in one of the many festivals or jump on a train to the city!! It's the best of both worlds!","Great location, close to shops, and transportation.  We live in a quiet street and summer is an ideal time to enjoy our home & Oak Park!",Bright clean spacious home in the heart of Oak Park 2 minute walk to the Blue line and Oak Park Ave bus line.,"We have bikes here, train and busses around the corner & UBER easily available.  We have parking but it's a quick walk to many great local spots!",False,False,False,False,,True,False,35.0,"[{'milestones': {'titles': ['<b>Jan 11, 3:00PM</b>', 'Check-in'], 'subtitles': [], 'type': 'check_in'}, 'localized_cancellation_policy_name': 'Moderate', 'cancellation_policy_label': 'moderate', 'cancellation_policy_price_type': None, 'cancellation_policy_price_factor': 0.0, 'cancellation_policy_id': 4, 'book_it_module_tooltip': 'Free cancellation for 48 hours', 'subtitle': 'After that, cancel before 3:00PM on Jan 6 and get a full refund, minus the service fee.'}]",0.0,0.0,0,2020-01-11,2020-01-18,2019-12-28,2018-08-17 20:54:39+00:00,2018-04-18 21:51:17+00:00
"- Quiet hours  9 P.M. to 8 A.M.   
- Pet friendly.  But dogs must be walked on a leash and their waste picked up, according to city ordinance.
- Contact host with type and number of pets.",1 bath,2 beds,2 bedrooms,4 guests,14091800,Vintage Apartment in Century Home with Parking,4,46,Shawn,[],Entire apartment,entire_home,1,,1,False,False,After 3PM,11AM,41.98,-87.667,1057.0,City of Chicago License #2411496,True,1.0,33,104,100.0,104,Your host won’t be on the property but they’ll be available for anything you need during your stay.,“Sunlight coming through the stained glass tulip windows in the living room is striking!”,False,"[""Distance from O'Hare International Airport"", '32 mins by car without traffic']",False,False,False,,5.0,This host offers a 20% monthly discount.,"[{'id': 5, 'is_business_ready_feature': False, 'is_present': True, 'is_safety_feature': False, 'name': 'Air conditioning'}, {'id': 12, 'is_business_ready_feature': False, 'is_present': True, 'is_safety_feature': False, 'name': 'Pets allowed'}, {'id': 92, 'is_business_ready_feature': False, 'is_present': True, 'is_safety_feature': False, 'name': 'Dishwasher'}, {'id': 34, 'is_business_ready_feature': False, 'is_present': True, 'is_safety_feature': False, 'name': 'Dryer'}, {'id': 30, 'is_business_ready_feature': False, 'is_present': True, 'is_safety_feature': False, 'name': 'Heating'}, {'id': 51, 'is_business_ready_feature': False, 'is_present': True, 'is_safety_feature': False, 'name': 'Self check-in'}, {'id': 33, 'is_business_ready_feature': False, 'is_present': True, 'is_safety_feature': False, 'name': 'Washer'}, {'id': 36, 'is_business_ready_feature': False, 'is_present': True, 'is_safety_feature': True, 'name': 'Carbon monoxide detector'}, {'id': 90, 'is_business_ready_feature': False, 'is_present': True, 'is_safety_feature': False, 'name': 'Coffee maker'}, {'id': 293, 'is_business_ready_feature': False, 'is_present': True, 'is_safety_feature': False, 'name': 'Bathroom essentials'}, {'id': 292, 'is_business_ready_feature': False, 'is_present': True, 'is_safety_feature': False, 'name': 'Bedroom comforts'}, {'id': 45, 'is_business_ready_feature': True, 'is_present': True, 'is_safety_feature': False, 'name': 'Hair dryer'}, {'id': 46, 'is_business_ready_feature': True, 'is_present': True, 'is_safety_feature': False, 'name': 'Iron'}, {'id': 1, 'is_business_ready_feature': False, 'is_present': True, 'is_safety_feature': False, 'name': 'TV'}, {'id': 35, 'is_business_ready_feature': False, 'is_present': True, 'is_safety_feature': True, 'name': 'Smoke detector'}, {'id': 4, 'is_business_ready_feature': False, 'is_present': True, 'is_safety_feature': False, 'name': 'Wifi'}, {'id': 39, 'is_business_ready_feature': False, 'is_present': True, 'is_safety_feature': True, 'name': 'Fire extinguisher'}, {'id': 66, 'is_business_ready_feature': False, 'is_present': True, 'is_safety_feature': False, 'name': 'Children’s books and toys'}, {'id': 101, 'is_business_ready_feature': False, 'is_present': True, 'is_safety_feature': False, 'name': 'Garden or backyard'}, {'id': 64, 'is_business_ready_feature': False, 'is_present': True, 'is_safety_feature': False, 'name': 'High chair'}, {'id': 72, 'is_business_ready_feature': False, 'is_present': True, 'is_safety_feature': False, 'name': 'Pack ’n Play/travel crib'}, {'id': 9, 'is_business_ready_feature': False, 'is_present': True, 'is_safety_feature': False, 'name': 'Free parking on premises'}, {'id': 23, 'is_business_ready_feature': False, 'is_present': True, 'is_safety_feature': False, 'name': 'Free street parking'}, {'id': 285, 'is_business_ready_feature': False, 'is_present': True, 'is_safety_feature': False, 'name': 'Full kitchen'}]","[{'type': 'LISTING_SELF_CHECKIN', 'message': 'Check yourself in with the keypad.', 'headline': 'Self check-in'}, {'type': 'LISTING_SUPER_HOST', 'message': 'Superhosts are experienced, highly rated hosts who are committed to providing great stays for guests.', 'headline': 'Shawn is a Superhost'}]","[{'type': 'requires_stairs', 'title': 'Must climb stairs'}]",,"[{'category': 'accuracy', 'value': 10, 'localized_rating': '5.0', 'percentage': 1.0}, {'category': 'communication', 'value': 10, 'localized_rating': '4.9', 'percentage': 0.982}, {'category': 'cleanliness', 'value': 10, 'localized_rating': '5.0', 'percentage': 1.0}, {'category': 'location', 'value': 10, 'localized_rating': '5.0', 'percentage': 0.994}, {'category': 'checkin', 'value': 10, 'localized_rating': '5.0', 'percentage': 0.998}, {'category': 'value', 'value': 10, 'localized_rating': '5.0', 'percentage': 0.992}]","[{'localized_text': 'Sparkling clean', 'localized_count_string': '18'}, {'localized_text': 'Amazing amenities', 'localized_count_string': '18'}, {'localized_text': 'Stylish space', 'localized_count_string': '18'}, {'localized_text': 'Outstanding hospitality', 'localized_count_string': '17'}, {'localized_text': 'Quick responses', 'localized_count_string': '17'}]","{1: [{'quantity': 1, 'type': 'king_bed'}]}",23496786,True,True,November 2014,100%,within an hour,False,https://a0.muscache.com/im/pictures/user/bbd82dae-c743-4fcf-b445-493813a49774.jpg?aki_policy=profile_large,"Guests will have access to the 2nd floor apartment, the basement for laundry, the backyard and 1/2 of the garage.","Indulge the senses in the historic charm of this 1913 Arts and Crafts apartment. Discover a carefully designed space featuring a mid-century modern aesthetic, contemporary finishes, a bright living space, and a backyard BBQ area.","- Quiet hours  9 P.M. to 8 A.M.   
- Pet friendly.  But dogs must be walked on a leash and their waste picked up, according to city ordinance.
- Contact host with type and number of pets.",Text us.  We are right down the street.,"Andersonville is an old Swedish area of the city where early 20th century architecture abounds. A replica of the original water tower, painted with the Swedish flag, sits atop the Swedish Museum. Small one-of-a-kind shops line Clark Street nearby. The Aragon Ballroom and the Riviera Theatre are just over a mile away.","Many neighborhoods in Chicago have at least one street festival in the summertime. Andersonville's is June 8th, 9th, and 10th, and it runs along Clark Street from Foster to Catalpa.  There are several different stages for music.  It's a ton of fun!

We are a licensed vacation rental with the City of Chicago #2411496","Our place is a large vintage 2 bedroom/1bath.  It was built in the early 1900's, in the Arts and Crafts style.  It retains much of the original charm with stained glass and wood details.  One of the bedrooms has a king bed.  The other has a queen.  There is a full kitchen for cooking and a beautiful backyard for grilling.  If you prefer to go out, we are just steps from Calo, Big Jones, Hamburger Mary's Ranalli's Pizza and Marty's Martini Bar.","Indulge the senses in the historic charm of this 1913 Arts and Crafts apartment. Discover a carefully designed space featuring a mid-century modern aesthetic, contemporary finishes, a bright living space, and a backyard BBQ area.",We are just a few blocks from the Red Line and within steps of major bus lines.   There are also Divvy Bikes available for rent at several kiosks in the neighborhood. These are bikes you take from one docking station and may be returned to a different docking station.,True,True,False,False,,True,True,60.0,"[{'milestones': {'titles': ['<b>Jan 11, 3:00PM</b>', 'Check-in'], 'subtitles': [], 'type': 'check_in'}, 'localized_cancellation_policy_name': 'Moderate', 'cancellation_policy_label': 'moderate', 'cancellation_policy_price_type': None, 'cancellation_policy_price_factor': 0.0, 'cancellation_policy_id': 4, 'book_it_module_tooltip': 'Free cancellation for 48 hours', 'subtitle': 'After that, cancel before 3:00PM on Jan 6 and get a full refund, minus the service fee.'}]",0.0,10.0,2,2020-01-11,2020-01-12,2019-12-28,2019-12-19 20:52:43+00:00,2017-03-26 13:34:23+00:00
